{
  "$schema": "https://json-schema.org/draft/2020-12/schema",
  "$id": "https://kytos.org/schema/connection-node/v1",
  "title": "ConnectionNode",
  "description": "지식 조각(노드) 사이의 관계를 표현하는 1급 객체. 관계 자체가 소유자, 신뢰도, 권한을 가진다.",
  "type": "object",
  "required": ["id", "type", "source", "target", "relation", "owner", "visibility", "created_at"],
  "properties": {
    "id": {
      "type": "string",
      "description": "전역 고유 식별자 (W3C DID 형식)",
      "pattern": "^did:kytos:[0-9a-f]{8}-[0-9a-f]{4}-[0-9a-f]{4}-[0-9a-f]{4}-[0-9a-f]{12}$",
      "examples": ["did:kytos:550e8400-e29b-41d4-a716-446655440000"]
    },
    "type": {
      "const": "connection",
      "description": "노드 타입 식별자"
    },
    "source": {
      "type": "string",
      "description": "관계의 출발 노드 id (W3C DID 형식)",
      "pattern": "^did:kytos:[0-9a-f]{8}-[0-9a-f]{4}-[0-9a-f]{4}-[0-9a-f]{4}-[0-9a-f]{12}$"
    },
    "target": {
      "type": "string",
      "description": "관계의 도착 노드 id (W3C DID 형식)",
      "pattern": "^did:kytos:[0-9a-f]{8}-[0-9a-f]{4}-[0-9a-f]{4}-[0-9a-f]{4}-[0-9a-f]{12}$"
    },
    "relation": {
      "type": "string",
      "enum": [
        "generates",
        "enables",
        "contains",
        "is_instance_of",
        "becomes",
        "amplifies",
        "inhibits",
        "entangles_with",
        "contradicts"
      ],
      "description": "관계 유형. 각 타입의 정의, 표준 매핑, 맥락별 레이블 → schema/relations.json"
    },
    "owner": {
      "type": "string",
      "description": "생성자 id. 사람이면 did:kytos:{uuid}, AI이면 did:kytos:agent:ai",
      "examples": [
        "did:kytos:550e8400-e29b-41d4-a716-446655440000",
        "did:kytos:agent:ai"
      ]
    },
    "confidence": {
      "type": ["number", "null"],
      "minimum": 0,
      "maximum": 1,
      "description": "AI 생성 시 신뢰도(0~1). 사람 생성 시 null.",
      "default": null
    },
    "visibility": {
      "type": "string",
      "pattern": "^(private|public|org:[a-z][a-z0-9-]*)$",
      "description": "접근 권한. private | public | org:{조직명}",
      "examples": ["private", "public", "org:spiratus", "org:bodytemple"]
    },
    "created_at": {
      "type": "string",
      "format": "date-time",
      "description": "기록 시간 (transaction time). 이 노드가 DB에 생성된 시각."
    },
    "valid_from": {
      "type": ["string", "null"],
      "format": "date",
      "description": "이 관계가 실제로 성립한 시작 시간 (valid time). null이면 created_at과 동일로 간주.",
      "default": null
    },
    "valid_until": {
      "type": ["string", "null"],
      "format": "date",
      "description": "이 관계의 유효 종료 시간. null이면 현재까지 유효.",
      "default": null
    },
    "note": {
      "type": "string",
      "description": "왜 이 연결을 만들었는지. 사람이 직접 만든 연결에 쓴다.",
      "default": ""
    },
    "proof": {
      "type": "object",
      "description": "암호 서명 (W3C Data Integrity). 블록체인 연동 시 사용. 현재는 선택 필드.",
      "properties": {
        "type": {
          "type": "string",
          "examples": ["Ed25519Signature2020"]
        },
        "verificationMethod": {
          "type": "string",
          "examples": ["did:kytos:{uuid}#key-1"]
        },
        "proofValue": {
          "type": "string"
        }
      },
      "required": ["type", "verificationMethod", "proofValue"]
    }
  },
  "additionalProperties": false
}
